{
  "$schema": "./schemas/copy.zh-CN.schema.json",
  "schemaVersion": "1.0.0",
  "version": "1.0.0",
  "locale": "zh-CN",
  "strings": {
    "game.title": "赵云与阿斗",
    "campaign.rank": "军士一",
    "map.julu.name": "巨鹿",
    "resource.protected.name": "阿斗",
    "resource.currency.name": "馒头",
    "stage.star-1.name": "烽燧初战",
    "stage.star-2.name": "疾骑突阵",
    "stage.star-3.name": "巨甲压境",
    "stage.star-4.name": "悍将破围",
    "stage.star-5.name": "魁首决战",
    "title.stage.locked": "锁",
    "title.stage.unlocked": "关",
    "title.stage.notUnlocked": "未解锁",
    "title.stage.summary": "第 {stage} 关 · {stageName} · 已解锁 {unlocked}/{total}",
    "title.reset": "重置进度",
    "title.reset.confirm": "再按一次确认重置",
    "title.reset.memoryOnly": "仅本次会话已重置 · 刷新后可能恢复",
    "title.start": "开始游戏",
    "title.ranking": "排行榜",
    "title.backpack": "武器背包",
    "title.board.protectedGlyph": "斗",
    "title.board.heroGlyph": "云",
    "title.board.heroName": "赵 云",
    "title.avatar.glyph": "云",
    "title.coin.glyph": "刀",
    "battle.camp": "营",
    "battle.gate": "营",
    "battle.status.stunned": "晕",
    "battle.recruit": "征兵",
    "battle.recruit.batch": "征满",
    "battle.recruit.batchPreview": "可征 {count} · 耗 {cost}",
    "battle.recruit.batchResult": "征得 {count} · 耗 {cost}",
    "battle.benchFull": "营满",
    "battle.recruit.shovel": "得铲子 ×1",
    "battle.recruit.result": "募得「{label}」",
    "battle.deploy.openLand": "开地",
    "battle.brush.result": "改作「{char}」",
    "battle.hero.join": "{heroName} 参战!",
    "battle.hero.cast": "【{heroName}】",
    "battle.wave.label": "第{wave}波",
    "battle.wave.ready": "点击迎敌",
    "battle.wave.incoming": "来袭 · {seconds}",
    "battle.wave.cleared": "第{wave}波克复 +{reward}馒头",
    "battle.pause.title": "战局暂停",
    "battle.pause.hint": "点左上暂停或按 P 继续",
    "battle.boss.name": "魁首",
    "battle.boss.incoming": "魁首来袭",
    "battle.danger": "危",
    "battle.enemy.defeated": "破",
    "battle.enemy.leak": "-1❤",
    "battle.shovel.generated": "洛阳铲产出普通铲 ×1",
    "battle.tool.pending": "待发",
    "battle.brush.hint": "点一个已部署普通单位改写成英雄字",
    "battle.shovel.hint": "把铲子拖到青色封地开垦",
    "result.victory": "大捷",
    "result.defeat": "败北",
    "result.victory.summary": "{stageName}告捷 · 歼敌 {kills}",
    "result.defeat.summary": "阿斗被掳… 撑到第 {wave} 波 · 歼敌 {kills}",
    "result.storageWarning": "存储受限 · 进度暂存于本次会话",
    "result.next": "下一关",
    "result.complete": "凯旋归营",
    "result.retry": "重整再战",
    "result.fiveStars": "五星",
    "status.title": "赵云与阿斗，{rank}，已获 {stars} 星，第 {stage} 关{notice}",
    "status.result": "{result}，第 {stage} 关，第 {wave} 波，歼敌 {kills}",
    "status.battle": "巨鹿，第 {stage} 关，第 {wave} 波，命 {lives}",
    "status.resetConfirm": "，请再次确认重置",
    "status.resetMemoryOnly": "，存储受限，刷新后旧进度可能恢复"
  },
  "stageNumerals": ["一", "二", "三", "四", "五"]
}
